NOME-ID,NOME
765,COMFERRO-J. ACACIO COM. DE FER
766,COMPANHIA BRASILEIRA DE DISTRIBUICAO
767,COMPANHIA DE TEATRO LIVRE MENT
768,COMPANHIA DE TEATRO TRUPE DO R
769,COMPANHIA PA DE TEATRO PESQ. P
770,COMPANY EVENTOS - BRUNA VASCON
771,COMPASSO COMUNICACAO E MARKETI
772,COMPUCARD IND. COM. E SERV. DE
773,COMPUSOFTWARE INFORMATICA LTDA
774,COMPUTER ID SOLUCOES EM INFORM
775,COMPUTER STORE (FILIAL WSHINGT
776,COMSED COMERCIO SERVICOS E DIS
777,COMUNIC PROMOCOES E EVENTOS
778,COMUNIQ - EUGENIA DA SILVA - M
779,CONAN SOLUCOES COM DESENVOLVIM
780,CONAUTEC SERV. DE MANUTENCAO E
781,CONCEITUAL COMERCIO DE EQUIP.
782,CONCERTINA SERVICOS E INSTALAC
783,CONCORD LOCACOES DE EQUIPAMENT
784,CONCORDIA SISTEMAS LTDA EPP
785,CONCRETISA CONSTRUCOES E EMPRE
786,CONDOMINIO PREMIUM
787,CONDOMINIO SHOPPING ALDEOTA EX
788,CONEMAR CONSULTORIA E MARKETIN
789,CONEX ENGENHARIA LTDA
790,CONFECCAO TRES CORACOES LTDA
791,CONFEDERACAO BRASILEIRA DE GIN
792,CONFIES-CONSELHO N. DAS FUND.D
793,CONFTEC SIST. DE SEGURANCA ELE
794,CONSELHO NAC. DAS FUNDACOES DE APOIO AS INST. DE ENSINO SUP. PESQ. CIEN. E TECNOLOGICA
795,CONSELHO REGIONAL DE CONTABIL.
796,CONSELHO REGIONAL DE CONTABILIDADE DO CEARA
797,CONSELHO REGIONAL DE ECONOMIA
798,CONSELHO REGIONAL DE ECONOMIA 8A. REGIAO-CE
799,CONSELHO REGIONAL DE ENGENHARIA E AGRONOMIA DO CEARA
800,CONSELHO REGIONAL DE FARMACIA
801,CONSELHO REGIONAL DE FARMACIA DO ESTADO DO CEARA
802,CONSIGO COM. DE CINE FOTO E SO
803,CONSPREL CONSTRUCAO E PROJETOS
804,CONSTRUCOES E LOCACOES ANSA LT
805,CONSTRUNORT - J.NOGUEIRA LIMA
806,CONSTRUTORA  CORREIA LIMA
807,CONSTRUTORA BELA VISTA LTDA
808,CONSTRUTORA CIMEL LTDA EPP
809,CONSTRUTORA IMPACTO COMERCIO E
810,CONSTRUTORA LC LTDA
811,CONSTRUTORA MARQUISE S/A
812,CONSTRUTORA MILENIO LTDA
813,CONSTRUTORA MULTIPLA LTDA ME
814,CONSTRUTORA NAUTICA COMERCIO E
815,CONSTRUTORA PLATO LTDA - ME
816,CONSTRUTORA S&V LTDA
817,CONSTRUTORA VALE DO HERMON LTD
818,CONSULT CONSULTORIA E ASSESSORIA TECNICA S/S LTDA
819,CONSULT CONSULTORIA E ASSSESSO
820,CONSULTRE CONSULTORIA E TREINA
821,CONTACTA CONSULT E SERV. DE TR
822,CONTATE CONSULTORIA E SERVICOS
823,CONTATO CONSULTORIA CONTABIL-M
824,CONTENCO INDUSTRIA E COMERCIO
825,CONTEX LOC. DE MAQUINAS E EQUI
826,CONTINUUM SERVICOS TECNICOS S/
827,CONTROL TECNOLOGIA E COMUNICAC
828,CONTROLLER EQUIPAMENTOS DE DES
829,CONTROLLER TI LTDA
830,COOP. MULT. P/ FORM. DE COOP.
831,COOPECON COOPERATIVA DE TRABAL
832,COOPERSERVICE COOPERAT. DE PRE
833,COOPERTAXI CARIRI - COOP.DOS T
834,COOPRATAF CCOPERATIVA DOS COND
835,COOPRATAF COOP DOS CONDUT DE RADIO TAXI DE FORTALEZA LTDA
836,COPHEL EXPRESS TECNOLOGIA DIGI
837,COPIADORA CENTRAL - F J BRITO
838,COPLAST COMERCIO DE EMBALAG. (
839,COPPETEC FUNDACAO - CENTRO DE
840,COPY CENTER LTDA
841,COPY MITA COMERCIO REPRESENTAC
842,COPY SIGN - FRANCISCO RODRIGUE
843,COPYMAX - FLAVIA FURTADO MORAI
844,CORENAV REPAROS NAVAIS LTDA
845,CORESC SEGURANCA DA INFORMACAO
846,COROA INDUSTRIA E COMERCIO S.A
847,CORPORA SERVICOS DE TRADUCOES
848,COSIL HOTEIS&TURISMO S/A(MERCU
849,COSTA AZUL VIAGENS - ANTONIO F
850,COSTA E CARVALHO CONSTRUCOES L
851,COSTA VIANA - SERVICOS DE COPI
852,COSTA VIANA - SERVICOS DE COPIAS LTDA - ME
853,COURAGE+KHAZAKA ELECTRONIC GMB
854,COUTO DO NORDESTE COMERCIO DE
855,COXPORT ENGENHARIA E COMERCIO
856,CP COMPANHIA DOS PLASTICOS ( Z
857,CPQT - CENTRO DE PESQUISA E QU
858,CPTI COOPERATIVA DE SERVICOS E
859,CPV BPF ADMINST.DE HOTEIS E RE
860,CQA - COMERCIAL QUIMICA AMERIC
861,CRA/CE CONSELHO REGIONAL DE AD
862,CRA/CE CONSELHO REGIONAL DE ADMINISTRACAO DO DO CEARA
863,CRATEUS VIAGENS
864,CRBB ENGENHARIA E CONSULTORIA
865,CREA-CE CONSELHO REGIONAL DE E
866,CRIAR COMERCIO E SERVICOS DE R
867,CRIATIVA - F.C. COML. PAP. E A
868,CRISTAL ( F. C. SOARES E SILVA
869,CRISTIANE DUTRA DA SILVA - MIC
870,CRISTINA DE FATIMA BRASIL SILV
871,CRISTINA SILVEIRA DA SILVA (RE
872,CROMATEC DO BRASIL COMERCIO DE
873,CROMOS COMERCIO DE PRODUTO PAR
874,CRONOCHIP SERVICOS DE CRONOMET
875,CRUZA IND. E COM. DE PROD. AGR
876,CS CASTELLUCCI INSTRUMENTACAO
877,CSI COMERCIO DE SEGURANCA E IN
878,CSLL
879,CT COMERCIAL FARMACEUTICA LTDA
880,CTCOMEX SERVICOS DE COMERCIO E
881,CTI CEARA TRANSPORTES INTERNAC
882,CUPULA ( A & A COMUNICACAO VIS
883,CV 1720-01 CARTA /TAXA LESC
884,D & M SERVICOS DE PUBLICIDADE E PROPAGANDA LTDA EPP
885,D M M S CAMPELO MAIA
886,D MF L E JR PRODUTOS DE LIMPEZ
887,D N A DISTRIBUIDORA NACIONAL D
888,D P BARBOSA MAQ.E FERRAMENTAS
889,D P I COMERCIO DE ELETRO ELETRONICOS LTDA ME
890,D S P  CONSULTORIA E EVENTOS -
891,D&G COMERCIO DE AUTOPECAS LTDA
892,D.W.S COMERCIO DE PROD. LAB. E
893,DABI ATLANTE DENTAL SERVICE (D
894,DAGUAPET ATACADO COM. &EXP.LTD
895,DAKO DO BRASIL DIST. PROD. DIA
896,DANIEL ADVOGADOS
897,DANIEL ANDRADE DANTAS GADELHA
898,DANIEL BAIMA TEIXEIRA
899,DANIEL FERREIRA TRANSPORTES ME
900,DANIEL SAMUGIM EPP
901,DANIELA MARTINS ALVES - EPP (C
902,DANILO MATTOS DE ALBUQUERQUE
903,DANUSA SILVA DE SOUSA -ME
904,DANUSA SILVA DE SOUZA -ME
905,DATA DISK INFORMATICA LTDA ME
906,DATA SHOW FORTALEZA LOCACAO DE
907,DATA TRANSPORTE E LOGISTICA
908,DATA VOICE COM. E SERV. LTDA
909,DATACAO COMERCIO & PRESTACAO D
910,DATAMIX COM. DE INFORMATICA E
911,DATASENSUS PESQUISA E CONSULTO
912,DATASONIC IND. E DIST. DE ELET
913,DAVI MORAIS DE MESQUITA
914,DAVID ELIAS DO NASCIMENTO E SA CAVALCANTE ME
915,DAYSIANE GOMES DAVID ME
916,DBR COMERCIO E IMPORTACAO DE M
917,DBS INDUSTRIA E COMERCIO LTDA
918,DCDN DISTRIB CUMMINS DIESEL DO
919,DEBORAH DE MORAES FARIA - ME
920,DECIO SIMOES PEREIRA EPP
921,DEFEL DEOLINDO FERRAGENS LTDA
922,DEFENSORIA GERAL DO ESTADO CE
923,DEGAGE AGENCIA DE NOTICIAS LTD
924,DEK COMERCIO E SERVICOS LTDA
925,DELIBERARTE PRODUTORA ARTISTIC
926,DELICIAS NO PESO LTDA
927,DELIN DISTRIBUIDORA - D DE OLI
928,DELL COMERCIAL DO BRASIL LTDA
929,DELL COMPUTADORES DO BRASIL LT
930,DELL COMPUTADORES DO BRASIL LTDA
931,DELLT SISTEMAS E INSTRUM. LTDA
932,DELOQUE JUNIOR SERVICOS EM AR
933,DELTA S SERVICOS DE ADMINISTRA
934,DELTA SIGN COMERCIO E SERVICOS
935,DELTALAB NORDESTE
936,DENIS BORGES BARBOSA ADVOGADOS
937,DENTAL GLOBO MAT.ODONTOL. LTDA
938,DENTAL S SEBASTIAO LTDA - ME
939,DENTALFOR COMERCIO E IMPORTACA
940,DEPARTAMENTO DE ADMINISTRACAO FINANANCEIRA-DAF
941,DEPARTAMENTO ESTADUAL DE TRANS
942,DEPARTAMENTO ESTADUAL DE TRANSITO
943,DEPOSITO JOVITA FEITOSA (GURGE
944,DEPOSITO O SENHORZINHO - FRANC
945,DERMA & DERMO COM. DE PROD. DE
946,DESCONEXO INDUSTRIA E COMERCIO
947,DESIGN ON DIVISORIAS LTDA
948,DESTAK - CORTINAS E PERSIANAS(
949,DEXCEL INFORMATICA LTDA - ME
950,DEZEN - PAULO ROBERTO ONOFRE B
951,DF COMERCIO DE TINTAS LTDA
952,DG DISTRIBUIDORA GIRAO - RDO R
953,DHL EXPRESS (BRAZIL) LTDA
954,DHL LOGISTICS BRAZIL LTDA
955,DHL WORDWIDE EXPRESS BRASIL LT
956,DHW ENGENHARIA E REPRESENTACAO
957,DIAGNOCEL -COM. E REPRESENTACO
958,DIAGNOSTICA IND. E COM. DE PRO
959,DIAGNOSTICOS DA AMERICA S/A
960,DIAGRAMA CONSTRUCOES E EMPREEN
961,DIAGSERVICE PRODUTOS E SERVICO
962,DIALOGO CONSULTORES ASSOCIADOS
963,DIALOGO SOCIAL
964,DIAMANTE AZUL EMP.HOTELEIRA(HO
965,DICOM COMERCIO E SERVICOS LTDA
966,DIEGO BATERIAS ME
967,DIFERENCIAL SERVICOS E TREINAM
968,DIFORMA - SANDRA HELENA DE MES
969,DIGILAB COMERCIO DE ACESSORIOS
970,DIGIPRON EQUIPAMENTOS ELETRONICOS LTDA ME
971,DIGITAL COLORS - NEWTON SOUSA
972,DIGITAL COMERCIO E SERVICOS GR
973,DIGITAL PRODUCOES - DIGITAL PR
974,DIGITAL RESULTS SOLUCOES CRIAT
975,DIGITAL SOM COMERCIAL DE INSTR
976,DIGITRON DA AMAZONIA INDUSTRIA
977,DIMENSAO ENGENHARIA  DE PROJET
978,DINAMICA CONTRUCOES E INSTALAC
979,DIOGO BARCHI MARQUEZINI - ME
980,DIOK CONSULTORIA E SOLUCOES EM
981,DIONEX BRASIL INSTRUMENTOS CIE
982,DIPROSEG DIST. DE PROD. DE SEG
983,DISANE DISTRIBUIDORA - ROSANE
984,DISCOVER INFORMATICA CAPISTRAN
985,DISCOVERY TOUR - ARS SERVICO T
986,DISK  DIGITAIS - LUIZ FERNANDO
987,DISK DIGITAIS - LUIZ FERNANDO
988,DISK PLACAS - R.M. CRISPIM PLA
989,DISPENS. DOS POBRES DO SAG.COR
990,DISQUETAXI FORTALEZA - UBIRATA
991,DISSEL - DISTRIBUIDORA DE PECA
992,DISTRIBIUIDORA GOMES LTDA
993,DISTRIBUIDORA  JL  ARAUJO  - F
994,DISTRIBUIDORA ADA - FRANCISCO
995,DISTRIBUIDORA CUMMINS DISEL DO
996,DISTRIBUIDORA DE AGUA FONTE DA
997,DISTRIBUIDORA DE MADEIRAS DO P
998,DISTRIBUIDORA PH DE CARNE LTDA
999,DISTRIBUUIDORA ELY MARTINS LTD
1000,DIVULGSIGN-V W IMPRESS.E COMUN
1001,DIXTAL BIOMETICA IND.E COM. LT
1002,DIZPENSER PROMOCOES E EVENTOS LTDA
1003,DM FILMES PRODUCOES ARTISTICAS
1004,DMC EQUIPAMENTOS LTDA EPP
1005,DMSS SOFTWARE LTDA
1006,DMT COMERCIO E SERVICO DE MOVE
1007,DNE COM. DE PROD. LABORAT. LTD
1008,DOCE MARAVILHA - FERNANDA MARI
1009,DOCUMENTECH GESTAO DE DOCUMENT
1010,DOLFHIN SERVICOS EMPRESARIAIS
1011,DOMINIO PROJETOS DECORACOES E
1012,DONA BELA PRODUCAO DE FILMES L
1013,DONA CHICA BAR E RESTAURANTE L
1014,DOUBLE MUSIC PRODUCOES E EVENT
1015,DOUGLAS DE PAULA ARAGAO 65211464320
1016,DOZI DISTRIBUIDORA DE EMBALAGE
1017,DPJ COMERCIAL LTDA
1018,DPUNION INSTRUMENTACAO ANAL. E
1019,DRAGAO DOS PARAFUSOS COMERCIAL
1020,DRAGER SAFETY DO BRASIL EQUIP.
1021,DRICOS MOVEIS E ELETRO DOMESTI
1022,DRICOS MOVEIS E ELETRO LTDA (ASS)
1023,DRICOS MOVEIS E ELETRODOMESTIC
1024,DROAD INFORMATICA E TELECOMUN
1025,DROPLET MEASUREMENT TECHNOLOGI
1026,DSP DIGITAL SISTEMAS DE PROTEC
1027,DSS CONSTRUCOES E SERVICOS LTD
1028,DTECH  SERVICOS  DE INFORMATIC
1029,DTS - COM VAREJSISTA DE EQUIP
1030,DUANA COM. DE MATERIAL P/ ESCR
1031,DUANA COMERCIO DE MATERIAL PARA ESCRITORIO LTDA
1032,DUARTE ASSSOCIADOS LTDA EPP-PR
1033,DULCE MARIA GIUSFREDI EQUIPAMENTOS AUDIOVISUAIS EPP
1034,DUO CLASSIC EVENTOS E PRODUCOE
1035,DUO EVENTOS - ULIANA LIMA PESS
1036,DUPLO AR - W.G. ALVES JUCA
1037,DURUM DO BRASIL IMP. COM. E EX
1038,DVP - DISTRIBUIDORA DE MADEIRA
1039,DX COMPUTADORES LTDA
1040,DevMedia Editora
1041,E & M INFORMATICA LTDA
1042,E A DE OLIVEIRA ENTRETENIMENTO
1043,E DO BRASILTECNOLOGIA LTDA
1044,E E DOS SANTOS -MAT.DE CONSTRU
1045,E KUROKI DA SILVA
1046,E N FREITAS - METAL VIDROS
1047,E REALIZACOES EDITORA LIV E DI
1048,E SPORTE SOLUCOES ESPORTIVAS LTDA
1049,E-WEB TECNOLOGIA LTDA
1050,E.J KRIEGER & CIA LTDA - PERMU
1051,E.L GALVAO & CIA LTDA
1052,E.P.U. PRODUCAO - ANTONIO ERAL
1053,EASYCROM COMERCIO E REPRESENTA
1054,EC DE AQUINO ARAUJO - EPP
1055,ECAD - ESCRITORIO CENTRAL DE ARRECADACAO E DISTRIBUICAO
1056,ECO MARINE AQUARIOS E EQUIPAME
1057,ECT - EMPRESA BRASILEIRA DE CORREIOS E TELEGRAFOS
1058,EDG EQUIPAMENTOS E CONTROLES L
1059,EDGETECH
1060,EDICOES ADUANEIRAS LTDA
1061,EDILMA DE OLIVEIRA SILVA ME
1062,EDIPUCRS
1063,EDITORA ARTE ESCRITA LTDA
1064,EDITORA BRASIL ENERGIA LTDA
1065,EDITORA CAROS AMIGOS LTDA
1066,EDITORA CELIGRAFICA FOTOLITO L
1067,EDITORA CP E AUDIOVISUAIS LTDA
1068,EDITORA DA UNIVERSIDADE FEDERA
1069,EDITORA E GRAFICA VR LTDA
1070,EDITORA EXPRESSAO POPULAR LTDA
1071,EDITORA FTD S/A FILIAL DE FORT
1072,EDITORA GRAFICA CEARASAT COMUN
1073,EDITORA LIVRARIA E TREINAM. LT
1074,EDITORA METHA LTDA
1075,EDITORA PEIROPOLIS LTDA
1076,EDITORA PINI LTDA
1077,EDITORA PRINTEX LTDA -ME
1078,EDITORA PRINTEX LTDA ME
1079,EDITORA VERDES MARES LTDA (DIA
1080,EDITORA VOZES LTDA
1081,EDITORIAL BOLINA BRASIL LTDA
1082,EDMAR NASC. PITOMBEIREIRA - SA
1083,EDMETA - EDITORA DIGITAL E IMP
1084,EDMUNDO HUGO M. DE OLIVEIRA -
1085,EDNA MARIA OLIVEIRA BARROS - M
1086,EDSON FIGUEIREDO ARTE E CULTUR
1087,EDUARDO JOSE ALBERTO MIRANDA -
1088,EDUCA - COOPERATIVA DE ENSINO
1089,EDUCADORA 7 DE SETEMBRO - FACU
1090,EDUCADORA SETE DE SETEMBRO LTDA
1091,EDUCP TREINAMENTOS E EDUC. PRO
1092,EDUMAQ IRRIGACAO MAQUINAS PECA
1093,EDZILL COPIAS LTDA
1094,EKIPAR- ENGENHARIA DE PROCESSO
1095,EL SHADDAI TRANSPORTES E TURIS
1096,EL SHADDAY MOVEIS - FRANCISCO
1097,ELAYELA COMERCIO E REPRESENTACAO COMERCIAL LTDA
1098,ELENYR MAQUINAS LTDA
1099,ELETRICA E ELETRONICA CONFIANC
1100,ELETRO AR - CLARA ESTELA TEIXE
1101,ELETRO TERRIVEL LTDA
1102,ELETRO.COM - MONICA H. N. PERE
1103,ELETROFIOS
1104,ELETRONI COMERCIO DE ELETRONIC
1105,ELETRONICA APOLO ALDEOTA LTDA
1106,ELETRONICA MORIA COM. E SERV.
1107,ELETRONICA MUSICAL COM. IMPORT
1108,ELETRONICA O BETO - SILVIA AND
1109,ELETRONICA PUTIU ERLANE DO CAR
1110,ELETRONICA SANTANA LTDA
1111,ELETRONICS MAGAZINE VI
1112,ELETROVALE SERV. DE ENG. LTDA
1113,ELEVADORES CONFIANCA LTDA ME
1114,ELEVADORES JAGUAR IND. E COM.
1115,ELEVADORES UNIAO LTDA EPP
1116,ELGA LABWATER
1117,ELIENE DO CARMO VICTOR - ME
1118,ELINEUSA CRISTINA PIMENTEL DE
1119,ELITE DEDETIZACOES INDUSTRIA E
1120,ELMI-TEC ASSIST. TEC. REFP. E
1121,ELSA HOENSCH IMPORT & EXPORT
1122,ELTON GOMES DA SILVA - FOTOIDE
1123,ELV EMPRESA LOCADORA DE VEICUL
1124,ELYTUR TURISMO LTDA
1125,EMATERCE - EMP. DE ASSIST. TEC
1126,EMERSON MONTEIRO HIDRAULIOS LT
1127,EMETECH - FCO ERIVAN DE ABREU
1128,EMFAL - EMPRESA FORNECEDORA DE
1129,EMG SYSTEM DO BRASIL-EPP
1130,EMIC EQUIPAMENTOS E SISTEMAS D
1131,EMIU-EMPRESA DE MANUTENCAO IND
1132,EMMARKA DISTRIBUIDORA DE MEDIC
1133,EMN-EMERGENCIAS MEDICAS DO NOR
1134,EMPLAQ IND. E COMERCIO DE PLAC
1135,EMPORIO DE FATIMA IND. E COM.
1136,EMPORIO VERTICE ED. DIST. DE L
1137,EMPREENDIMENTOS PAGUE MENOS S/
1138,EMPRESA BRAS. DE CORREIOS E TE
1139,EMPRESA BRASILEIRA DE CORREIOS E TELEGRAFOS
1140,EMPRESA BRASILEIRA DE TELECOM.
1141,EMPRESA BRASILEIRA DE TELECOMUNICACAO S/A
1142,EMPRESA DE REDE DE TECNOLOGIA
1143,EMPRESA DE TECNOLOGIA DA INFORMACAO DO ESTADO DO CEARA
1144,EMPRESA JORNALISTICA O POVO S.A
1145,EMPRESA JORNALISTICA O POVO S/
1146,EMPRESA SAO BENEDITO LTDA
1147,EMPRESA VITORIA
1148,EMSA EQUIPAMENTOS MEDICOS
1149,EN-BRASIL COMERCIO E SERVICOS
1150,ENCOMENDAS E TRANSPORTES DE CA
1151,ENEL
1152,ENERTRONIC INDUSTRIAL LTDA EPP
1153,ENGEART CONSTRUCOES ARTE & PRO
1154,ENGECER LTDA
1155,ENOC QUEIROZ DE PAIVA NETO
1156,ENPECEL ENGENHARIA LTDA
1157,ENTE TECNOLOGIA EM GESTAO DE P
1158,ENTE TECNOLOGIA EM GESTAO DE PESSOAS LTDA ME
1159,EPPENDORF AG
1160,EPPENDORF DO BRASIL LTDA
1161,EPRESA DE TECNOLOGIA DA INFORMACAO DO ESTADO DO CEARA
1162,EQUACIONAL ELETRICA E MECANICA
1163,EQUILAB INC
1164,EQUIP INDL COM. DE EQUIPAMENTO
1165,EQUIPALAB COM. ATACADISTA DE P
1166,EQUIPAM COM. E REPRES. DE EPI
1167,EQUIPAMENTOS CIENTIFICOS INSTR
1168,EQUIPAR SOLUCOES TECNOLOGICAS-
1169,EQUIPECAS EQUIP.PECAS E ACESS.
1170,EQUIPESCA EQUIPAMENTOS DE PESC
1171,EQUIPOS MEDICOS COM. E REPRES.
1172,EQUITRONIC EQUIPAMENTOS ELETRONICOS LTDA
1173,ER COMERCIAL - MATERIAIS PARA
1174,ERANDI ALVES DE ALBUQUERQUE SI
1175,ERANDI ALVES DE ALBUQUERQUE SILVA -58043640300
1176,ERCILIO BARBOSA LIMA ME
1177,ERFRANIUO MAIA DOS SANTOS
1178,ERICA PONTES DE MENESES - ME (
1179,ERICO DE SOUSA NETO
1180,ERIOS EQUIPAMENTOS TECNICOS E
1181,ERLI MAQUINAS P/ LAB. FARMACEU
1182,ERNANDES DE SOUSA MAIA
1183,ERS TELECOM COMERCIO E SERV.LT
1184,ERVIEGAS INSTRUMENTAL CIRURGIC
1185,ESAFI - ESCOLA DE ADMINIST. E
1186,"ESALAB IMP., EXPORT. E COM. LT"
1187,ESCRITA IND E SERV DE SUPRIMEN
1188,ESCRITORIO CENTRAL DE ARRECADACAO E DISTRIBUICAO ECAD
1189,ESFERA COMERCIO E SERVICO LTDA
1190,ESMALTEC S/A
1191,ESPACO CENTER - SOUSA E SILVA
1192,ESPACO CULTURAL ARRE EGUA ( T.
1193,ESPACO MUSICAL-COM. DE INSTR.
1194,ESPEDITO DANIEL SOUZA LIMA
1195,ESQUADRO PISO - FRANCISCO MARC
1196,ESSE-ENE COMERCIO E SERVICOS L
1197,ESSE-ENE COMERCIO E SERVICOS LTDA
1198,ESSS - ENGINEERING SIMULATION
1199,ESTAR BEM DISTRIBUIDORA DE ALI
1200,ESTAR BEM DISTRIBUIDORA DE ALIMENTOS LTDA
1201,ESTOK COMERCIO E REPRESENTACOES LTDA
1202,ESTRELA 21 EDITORACAO LTDA
1203,ESTRELA DO MAR PRODUCOES ARTIS
1204,ETICE-EMPRESA DE TECNOLOGIA DA
1205,ETINA COMERCIAL DE INFORMATICA
1206,ETMETAL COMERCIO E INDUSTRIADE PLACAS METALICAS LTDA -EPP
1207,EUDES DISTRIBUIDORA DE INSUMOS FAMACEUTICOS  EIRELI-EPP
1208,EUDORA ENERGIA LTDA
1209,EUMAC COMERCIO DE BRINDES E PR
1210,EUMAC COMERCIO DE BRINDES E SE
1211,EUROCOPIAS REPRODUCOES E SERVI
1212,EUROJET - ANA ELZA MARTINS MOT
1213,EUROTHERM LTDA
1214,EVA BATLICKOVA - ME
1215,EVIALIS DO BRASIL NUTRICAO ANI
1216,EVOLZ IND. COM. E SERV. DE EQU
1217,EVONIK DDEGUSSA BRASIL LTDA
1218,EXACTA FERRAMENTARIA E USINAGE
1219,EXCEDE COMERCIO ELETRO ELETRON
1220,EXCELENCIA COM. E SERVICOS DE
1221,EXECUTE COMPUTADORES - V. ROCH
1222,EXPLENTUR EMP.HOTELEIROS E TUI
1223,EXPRESS TCM LTDA
1224,EXPRESSAO GRAFICA E EDITORA LT
1225,EXPRESSAO GRAFICA E EDITORA LTDA
1226,EXPRESSO GUANABARA
1227,EXPRESSO GUANABARA S/A
1228,EXPRESSO MERCURIO S.A
1229,EXPRESSO SAO MIGUEL - GILSON D
1230,EXTINFOGO - CASA DOS EXTINTORE
1231,EXTINZON - EXTINTORES PINZON L
1232,EXTRA HIPERMERCADOS
1233,EXTRA HIPERMERCADOS (COMPANHIA
1234,EXTRA HIPERMERCADOS - CIA. BRA
1235,EXTRALAB BRASIL COM. E MANUT.
1236,EYES ON THE ROAD PRODUCOES COM
1237,EZUS LYON
1238,Ermilson do Carmo Victor (Elet
1239,F  S N DE OLIVEIRA-ME(COMERCIA
1240,F A DE FREITAS OLIVEIRA ME
1241,F A DE FREITAS OLIVEIRA-ME  -
1242,F A PRODUCOES E SERVICOS-FELIP
1243,F ANTONIO VIANA DE PAULA ME
1244,F E G COMUNICACAO VISUAL LTDA
1245,F F GOMES DE SOUSA - ME (COMER
1246,F FERREIRA DE SOUZA MANUTENCAO
1247,F GALVAO DE MENEZES ME
1248,F J ALEXANDRE DA SILVA-ALEX CO
1249,F JOSE DE SOUZA VARIEDADES EPP
1250,F L J DE ARAUJO
1251,F LOPES PUBLICIDADE LTDA
1252,F M ARAUJO BEZERRA ME
1253,F R LIMA FILHO - ME
1254,F S N DE OLIVEIRA - ME
1255,F S VASCONCELOS E CIA LTDA (MA
1256,F VALTER E CIA LTDA (ELETR. AP
1257,F W M DE SOUSA - WALBERCAR
1258,F W PEREIRA LIMA-ME
1259,F-TREZE TECNOLOGIA LTDA
1260,F. FARIAS FILHO - ME QUIONDA F
1261,F. G. DE PONTES SILVA - ME (SE
1262,F. VILAMARQUES M. COSTA ME
1263,F.A. FREITAS OLIVEIRA-ME
1264,F.C. DA S. PEREIRA-VALDEMI ROC
1265,F.G COMERCIO DE MOVEIS E EQUIP
1266,F.G. PNEUS LTDA
1267,F.M. COM. E SERVICO DE PECAS A
1268,F1 COM.DE MOTOCICLETAS LTDA
1269,FA LIMA INFORMATICA - EPP (GIG
1270,FABRICA DA MIDIA - RICARDO CES
1271,FACILITA SERVICOS - JOSE DEUSD
1272,FACULDADE CATOLICAS
1273,FADE - FUNDACAO DE APOIO E DES
1274,FAGRON DO BRASIL FARMACEUTICA
1275,FAMA COMERCIO DE ARTIGOS FOTOG
1276,FAMAS FORTALEZA AUTO MAQUINAS
1277,FAMAX PRESTACAO DE SERVICOS LT
1278,FAMOBIL - O M IND. E COM. DE M
1279,FAP INFORMATICA LTDA (IBYTE CO
1280,FARMAZON - FARMACIA AMAZONAS L
1281,FARNELL-NEWARK BRASIL DISTR. D
1282,FAST JOB SERVICOS DE RECOLOCAC
1283,FAST SERVICE. COM. SERV. DE IN
1284,FAST SHOP COMERCIAL SA
1285,FASTBIO LTDA ME
1286,FATURA ADM.IMOB.&TURISTICA LTD
1287,FAZAUTO FORTALEZA AUTOMOTORES
1288,FB PAPELARIA - FB COM. DE PAPE
1289,FB QUIMICA LTDA
1290,FC COMERCIO E SERVICOS DE COMUNICACAO LTDA - ME
1291,FC COMUNICACOES - FC COMERCIO
1292,FCO. EUDES APOLIANO GOMES(DIST
1293,FCO. JOSE FERREIRA DE ARAUJO -
1294,FEDERACAO DO COMERCIO DO ESTAD
1295,FEDERACAO DO COMERCIO DO ESTADO DO CEARA
1296,FEDERACAO UNIVERSITARIA CEARENSE DE ESPORTES
1297,FEDERAL EXPRESS CORPORATION
1298,FEDEX BRASIL LOGISTICA E TRANS
1299,FEDEX BRASIL LOGISTICA E TRANSPORTE S.A
1300,FELIPE FERNANDES AZEVEDO - ME
1301,FELIPE LUCIANO ALMEIDA DA SILVA
1302,FELIPE SOBREIRA RODRIGUES
1303,FELIPPE RODRIGUES DOS SANTOS EMBALAGENS
1304,FELIPPE RODRIGUES SANTOS EMBAL
1305,FELLIPELLI  INSTR. DE DIAG. E
1306,FELLIPELLI INSTRUMENTOS DE DIAGNOSTICO E DESENVOLVIMENTO ORGANIZACIONAL
1307,FEMTO INDUSTRIA E COM. DE INST
1308,FENIX RENT A CAR
1309,FERGAVI COMERCIAL LTDA EPP
1310,FERMISA COMERCIO DE FERRAGENS
1311,FERNANDA ALBUQUERQUE MAIA
1312,FERNANDES EQUIP. P/ FISIOTERAP
1313,FERNANDO AUGUSTO CARNEIRO LIRA
1314,FERNANDO JORGE DA CUNHA SILVA
1315,FERNANDO JORGE DA CUNHA SILVA 64364224391
1316,"FERRALP - FERRO, ALUMINIO E PN"
1317,FERRAMENTAS GERAIS COMERCIO E
1318,FERRAMENTAS GERAIS COMERCIO E IMPORTACAO DE FERRAMENTAS E MAQUINAS LTDA
1319,FERRARA SERVICOS DE CONSTRUCOE
1320,FERREIRA LOCACAO E SERVICO LTD
1321,FERREIRA SERVICOS LTDA
1322,FERRO & ACO COMERCIAL LTDA
1323,FERTIL VIDA PRODUTOS AGRICOLAS
1324,FESTO BRASIL LTDA
1325,FET INFORMATICA E SEGURANCA EL
1326,FIAT AUTOMOVEIS S/A.(FCA FIAT
1327,FIBRACEM TELEINFORMATICA LTDA
1328,FIBRATEC IND. COM.DE FIBERGLAS
1329,FIESTASS BUFFET LTDA - ME
1330,FILTERFLUX EQUIPAMENTOS PARA L
1331,FINATEC FUNDACAO DE EMPREEND.C
1332,FIRMINO ROCHA AGUIAR LTDA
1333,FISATOM EQUIPAMENTOS CIENTIFIC
1334,FIT FLEXTRONICS INSTITUTO DE T
1335,FITOGRAFF COM. SERVICOS DE IMP
1336,FIUZA E GUALBERTO LTDA - ME
1337,FIX ORGANIZADORA DE EVENTOS LT
1338,FJ SERVICOS EM AR CONDIC. LTDA
1339,FJ SERVICOS EM AR CONDICIONADOS LTDA
1340,FLA COMERCIAL LTDA
1341,FLATECK NORDESTE ELETRONICA CO
1342,FLAY IND. COM. DE CAPACHOS LTD
1343,FLOR CIRURGICA COMERCIAL LTDA-
1344,FLUKE DO BRASIL LTDA
1345,FLYFAST - HD COMERCIAL DE INFO
1346,FLYTOUR - IDRB VIAGENS E TURIS
1347,FMAG MIRTES M NOGUEIRA DE QUEI
1348,FOCO FERRAMENTAS E EQUIPAMENTO
1349,FOCUS FOTO & VIDEO-ADILIA SEVE
1350,FOCUS PHOTOS - DAVI P. DOS SAN
1351,FOKAL EQUIPAMENTOS INDUSTRIAIS
1352,FONTE DO LIVRO LTDA
1353,FONTE ENGENHARIA CONSULTORIAE
1354,FONTEPECAS LTDA.
1355,FORCE LINE IND. E COM. DE COMP
1356,FORLAB COM. DE EQUIP. E MAT. P
1357,FORMA CRIATIVA COM. E SERV. DE
1358,FORMASA  FORTALEZA MAQUINAS AU
1359,FORRO & CIA - MOREIRA COSTA CO
1360,FORT EVENTOS (FCA. CHIRLENE LI
1361,FORT FILM & ACESSORIOS - ROZAN
1362,FORT GAS M.C.R. CASTRO SILVA -
1363,FORT MAX - FRANCISCO REGYS ARA
1364,FORTAL CADEIRAS E SERVICOS
1365,FORTAL COMERCIO DE GASES LTDA
1366,FORTAL COPY - F. NEVES DE ARAG
1367,FORTALEZA ATLANTICO HOTEIS LTD
1368,FORTALEZA COMERCIO DE ACRILICO
1369,FORTALEZA COMERCIO DE MAT. HOS
1370,FORTALEZA DAS BATERIAS LTDA
1371,FORTBELT INDUSTRIA DE ARTEFATO
1372,FORTCOLOR TINTAS E VERNIZES LT
1373,FORTCOPY COMERCIO E SERVICOS L
1374,FORTE CONSTRUCOES LTDA
1375,FORTE E SOUSA COM. SERV. E CON
1376,FORTEC COM E SERV LTDA ME
1377,FORTECH COM.E SERVICO DE FORRO
1378,FORTEL INDUSTRIA E COMERCIO LT
1379,FORTES DISTRIBUIDORA LTDA
1380,FORTES INFORMATICA
1381,FORTES INFORMATICA LTDA
1382,FORTES TECNOLOGIA EM SISTEMA LTDA
1383,FORTLEV INDUSTRIA E COMERCIO DE PLASTICOS LTDA
1384,FORTLIVROS - FORTALEZA LIVROS
1385,FORTVET COM. VAREJISTA DE PROD
1386,FOSFATEC INDUSTRIA E COMERCIO
1387,FPS DISTRIBUIDORA - FRANCINALD
1388,FRANA MUDANCAS E FRETES- ANA M
1389,FRANCA S BUFFET - FRANCISCA FR
1390,FRANCISCA DOS SANTOS LOPES - M
1391,FRANCISCA DOS SANTOS LOPES - ME
1392,FRANCISCA ELIZABETH PINTO LOPE
1393,FRANCISCA MILENA CARNEIRO DE OLIVEIRA - MEI
1394,FRANCISCA SILVANA PEREIRA PAIV
1395,FRANCISCO ADRIANO ROCHA UCHOA
1396,FRANCISCO ALVES AMARANTE - FA
1397,FRANCISCO ALVES AMARANTE - ME
1398,FRANCISCO BRAGA DE SOUZA JUNIO
1399,FRANCISCO CLECIO ALBUQUERQUE F
1400,FRANCISCO DANIEL DE LIMA - ME
1401,FRANCISCO DANIEL LIMA PEREIRA ME
1402,FRANCISCO FABIO VIANA SILVA - ME
1403,FRANCISCO HELCIO DA C. VIANA -
1404,FRANCISCO JORGE RODRIGUES (COZ
1405,FRANCISCO JOSE DE ALBUQUERQUE
1406,FRANCISCO JOSE DE ALBUQUERQUE MARQUES JUNIOR 26045176391
1407,FRANCISCO JOSE FERREIRA DE ARA
1408,FRANCISCO JOSE MAFRENSE DE SOU
1409,FRANCISCO LEONARDO SILVA DE SOUZA 61344664334
1410,FRANCISCO LUIZ SAMPAIO DE OLIV
1411,FRANCISCO MAMEDE  ARAUJO BEZER
1412,FRANCISCO MARCIO DE ARAUJO - V
1413,FRANCISCO NILTON MARCIEL PIRES EPP
1414,FRANCISCO OCELIO DA S. PEREIRA
1415,FRANCISCO RAMOS BEZERRA JUNIOR
1416,FRANCISCO ROSSIBERY MARTINS DO
1417,FRANCISCO SANTANA DE CARVALHO
1418,FRANCISCO SIDNEY BRITO & CIA L
1419,FRANCY COPIAS - MANOEL MAGALHA
1420,FRANKLIN SALES VENANCIO
1421,FRETCAR TRANSP.LOCACAO E TURIS
1422,FRETCAR TRANSPORTES RODOVIARIOS LTDA
1423,FRIEDA ERIANE MENEZES TELES CA
1424,FRIGELAR COMERCIO E DISTRIBUIC
1425,FRIGELAR COMERCIO E INDUSTRIA LTDA - FILIAL BELO HORIZONTE
1426,FRIO ELETRICA - J B DIAS DO NA
1427,FRL SUPRIM. PARA LABORATORIOS
1428,FRONIUS DO BRASILCOM.INDUSTRIA
1429,FROTA ADUANEIRA LTDA
1430,FROTA COMERCIO E SERVICO DE EX
1431,FROTA COMERCIO E SERVICOS EM EXTINTORES LTDA
1432,FROTA RIBEIRO COM.DE FERRAGENS
1433,FROTALIMENTOS - FROTA COM. DE
1434,FSI SUL AMERICANA IND. COM. E
1435,FT OLIVEIRA MATOS - ME (SE SEG
1436,FUNAB - FUNDO NACIONAL ANTI DR
1437,FUNARBE - FUNDACAO ARTHUR BERN
1438,FUND. DE AMPARO A PESQ. DE REC
1439,FUNDA DE AMPARO E DESENV DA PESQUISA
1440,FUNDACAO ARTHUR BERNARDES
1441,FUNDACAO BIOMINAS
1442,FUNDACAO CEARENSE DE PESQUISA
1443,FUNDACAO CEARENSE DE PESQUISA E CULTURA
1444,FUNDACAO CENTRO TECNOLOGICO JU
1445,FUNDACAO DE APOIO A PESQUISA -
1446,FUNDACAO DE APOIO A UNIVERSIDA
1447,FUNDACAO DEMOCRITO ROCHA
1448,FUNDACAO EDSON QUEIROZ - UNIFO
1449,FUNDACAO EDUCATIVA SALESIANA P
1450,FUNDACAO EDUCATIVA SALESIANA PADRE CICERO
1451,FUNDACAO ESCOLA POLIECNICA DA
1452,FUNDACAO FACULDADE DE MEDICINA
1453,FUNDACAO GETULIO VARGAS
1454,FUNDACAO INSTITUTO DE PESQUISAS FARMACEUTICAS
1455,FUNDACAO MIGUEL DE CERVANTES
1456,FUNDACAO NORTE RIOGRANDENSE DE
1457,FUNDACAO SOUSA ANDRADE DE APOI
1458,FUNDACAO UNIVERSIDADE FEDERAL
1459,FUNDAÃ‡AO DE DESENV.DA UNICAMP-
1460,FUNDAÇÃO CEARENSE DE PESQUISA E CULTURA
1461,FUNDEP - FUNDACAO DE DESENVOLV
1462,FUNDO NACIONAL ANTI-DROGAS - F
1463,FUNDO NACIONAL ANTIDROGAS - FUNAD
1464,FUNDO NACIONAL DE DESENV. CIEN
1465,FUNDUNESP-FUNDACAO P/O DESENVO
1466,FUNPAR FUUND.DA UNIV.DO PAR.P/
1467,FUNPEC - FUNDACAO NORTE-RIOG.
1468,FURLAB ARTIGOS P/ LABORATORIO
1469,FWM DE SOUSA
1470,G & Q GESTAO E QUALIDADE CONSU
1471,G E A SERV ESP EM AVAL. E TECN
1472,G E COMERCIO DE MOVEIS LTDA
1473,G E Q GESTAO E QUALIDADE CONSU
1474,G F MONTAGEM E MANUTENCAO INDU
1475,G M TOMAZI
1476,G&Q GESTAO E QUALIDADE CONSULTORES LTDA EPP
1477,G.B.DE OLIVEIRA E CIA LTDA
1478,G.M ASSISTENCIA TECNICA LTDA
1479,G.Z. EDITORA E PROMOTORA DE EV
1480,G4FLEX COM. E SERV. DE INFORMA
1481,GABRIEL BEZERRA DE ANDRADE -ME
1482,GALENA QUIMICA E FARMACEUTICA
1483,GAMALYRA COMERCIO E SERVICOS LTDA
1484,GANA REPRESENTACAO COMERCIO E
1485,GARIN COPIAS GRAFICA RAPIDA E
1486,GARIN COPIAS GRAFICA RAPIDA LTDA
1487,GASART TECNOLOGIA LTDA
1488,GASFILHO CONSULTORIA E ASSESS.
1489,GAUDENZI MELO PREST. DE SERVIC
1490,GB GRAFICA - HB EDITORA E GRAF
1491,GE HEALTHCARE BIO-SCIENCES COR
1492,GE HEALTHCARE LIFE SCIENCES DO
1493,GEFRIO IND. E COM. DE REFRIGER
1494,GEFRIO INDUSTRIA E COMERCIO DE REFIGERADORES LTDA
1495,GELAR REFRIGERACAO COMERCIAL L
1496,GELO ESCAMA - D & I INDUSTRIA
1497,GEMINUS ELETRONICA IND. E COM.
1498,GEMINUS ELETRONICA INDUSTRIA E COMERCIO LTDA
1499,GENETICA COM. IMPORTACAO E EXP
1500,GEOANALISE SERVICOS TECNICOS G
1501,GEOLOGICA ASSESSORIA  PROJETOS
1502,GEOMAC GEOLOGIA MINERACAO ASSE
1503,GEOMENSURA COMERCIAL LTDA - EP
1504,"GEOPHYSICAL SURVEY SYSTEMS, IN"
1505,GEOPLAN S/C LTDA
